{
  "$schema": "urn:techpub:schema:v1:parse-failure-report:frozen-2",
  "schemaVersion": "techpub.parse-failure-report.v1",
  "contractRevision": "frozen.2",
  "failureId": "urn:techpub:parse-failure:v1:sha256:b9b4ecc51d128036ab4529ee07f60967ad4d4d3d0e5178d2a43110b6f1063e01",
  "sourceKind": "native_s1000d",
  "inputRef": "contract://fixtures/source/native-s1000d-issue-4-2",
  "inputHash": "sha256:9aec4702ab8a658af9680f1d2cf9c0df77d1f2e79e40c6df0105acfb439caf06",
  "stage": "schema_binding",
  "code": "S1000D.LOCAL_SCHEMA_MISSING",
  "message": "A referenced local S1000D schema is absent; no parsed package is produced.",
  "blocking": true,
  "packageProduced": false,
  "producer": {
    "name": "techpub-s1000d-u0-fixture-projector",
    "version": "frozen.2",
    "buildHash": "sha256:19cbe7650e70cfe5a07e24529703c102859968ecd953e81c305cfd284f04652c"
  },
  "observedAt": "2026-08-11T00:00:00Z",
  "parameters": {
    "fixture": true,
    "scenario": "native-local-schema-missing"
  }
}
